{
  "schema_version": "cmb.epistemic-radar.v1",
  "generated_at": null,
  "current_timespan": "24h",
  "baseline_timespan": "7d",
  "source": {
    "name": "GDELT Project DOC 2.0 API",
    "endpoint": "https://api.gdeltproject.org/api/v2/doc/doc"
  },
  "epistemic_boundaries": [
    "PATTERN != PROOF",
    "DISCREPANCY_FLAG != CONTRADICTION_PROOF",
    "EMERGING_TERM != NEW_TECHNOLOGY_PROOF",
    "HUMAN_AGENCY > MACHINE_AUTHORITY"
  ],
  "summary": {
    "current_story_count": 0,
    "current_domain_count": 0,
    "cluster_count": 0,
    "discrepancy_cluster_count": 0,
    "high_consequence_cluster_count": 0,
    "technology_signal_count": 0
  },
  "boundary_counts": {
    "PREDICT": 0,
    "GENERATE": 0,
    "ACT": 0
  },
  "technology_signals": [],
  "emerging_vocabulary": [],
  "clusters": []
}
